Bus Hound 6.00 capture on Windows Vista (x64). Complements of www.perisoft.net

  Device - Device ID (followed by the endpoint for USB devices)
            (12) USB Composite Device
            (17) USB Input Device
            (18) USB Input Device
            (32) USB Input Device
            (33) USB Input Device
  Phase  - Phase Type
            CTL   USB control transfer       
            IN    Data in transfer           
            OUT   Data out transfer          
            USTS  USB status                 
  Data   - Hex dump of the data transferred
  Descr  - Description of the phase
  Cmd... - Position in the captured data


Device  Phase  Data                                                                                                    Description                       Cmd.Phase.Ofs(rep)
------  -----  ------------------------------------------------------------------------------------------------------  --------------------------------  ------------------
  17.0  CTL    21 0a 00 00  00 00 00 00                                                                                SET IDLE                                 1.1.0        
  18.0  CTL    21 0a 00 00  01 00 00 00                                                                                SET IDLE                                 2.1.0        
  17.0  USTS   c0000004                                                                                                stall pid                                1.2.0        
  18.0  USTS   c0000004                                                                                                stall pid                                2.2.0        
  17.0  CTL    80 06 03 03  09 04 02 04                                                                                GET DESCRIPTOR                           3.1.0        
  17.0  IN     32 03 32 00  34 00 45 00  32 00 32 00  46 00 41 00  46 00 35 00  35 00 45 00  36 00 30 00  37 00 45 00  2.2.4.E.2.2.F.A.F.5.5.E.6.0.7.E.         3.2.0        
               35 00 36 00  34 00 41 00  30 00 35 00  33 00 35 00  36 00                                               5.6.4.A.0.5.3.5.6.                       3.2.32       
  17.0  CTL    80 06 01 03  09 04 02 04                                                                                GET DESCRIPTOR                           4.1.0        
  17.0  IN     18 03 53 00  61 00 74 00  6f 00 73 00  68 00 69 00  4c 00 61 00  62 00 73 00                            ..S.a.t.o.s.h.i.L.a.b.s.                 4.2.0        
  17.0  CTL    80 06 04 03  09 04 02 04                                                                                GET DESCRIPTOR                           5.1.0        
  17.0  IN     22 03 54 00  52 00 45 00  5a 00 4f 00  52 00 20 00  49 00 6e 00  74 00 65 00  72 00 66 00  61 00 63 00  ".T.R.E.Z.O.R. .I.n.t.e.r.f.a.c.         5.2.0        
               65 00                                                                                                   e.                                       5.2.32       
  18.0  CTL    80 06 03 03  09 04 02 04                                                                                GET DESCRIPTOR                           6.1.0        
  18.0  IN     32 03 32 00  34 00 45 00  32 00 32 00  46 00 41 00  46 00 35 00  35 00 45 00  36 00 30 00  37 00 45 00  2.2.4.E.2.2.F.A.F.5.5.E.6.0.7.E.         6.2.0        
               35 00 36 00  34 00 41 00  30 00 35 00  33 00 35 00  36 00                                               5.6.4.A.0.5.3.5.6.                       6.2.32       
  18.0  CTL    80 06 01 03  09 04 02 04                                                                                GET DESCRIPTOR                           7.1.0        
  18.0  IN     18 03 53 00  61 00 74 00  6f 00 73 00  68 00 69 00  4c 00 61 00  62 00 73 00                            ..S.a.t.o.s.h.i.L.a.b.s.                 7.2.0        
  18.0  CTL    80 06 06 03  09 04 02 04                                                                                GET DESCRIPTOR                           8.1.0        
  18.0  IN     1c 03 55 00  32 00 46 00  20 00 49 00  6e 00 74 00  65 00 72 00  66 00 61 00  63 00 65 00               ..U.2.F. .I.n.t.e.r.f.a.c.e.             8.2.0        
  17.0  CTL    80 06 03 03  09 04 02 04                                                                                GET DESCRIPTOR                           9.1.0        
  17.0  IN     32 03 32 00  34 00 45 00  32 00 32 00  46 00 41 00  46 00 35 00  35 00 45 00  36 00 30 00  37 00 45 00  2.2.4.E.2.2.F.A.F.5.5.E.6.0.7.E.         9.2.0        
               35 00 36 00  34 00 41 00  30 00 35 00  33 00 35 00  36 00                                               5.6.4.A.0.5.3.5.6.                       9.2.32       
  17.0  CTL    80 06 01 03  09 04 02 04                                                                                GET DESCRIPTOR                          10.1.0        
  17.0  IN     18 03 53 00  61 00 74 00  6f 00 73 00  68 00 69 00  4c 00 61 00  62 00 73 00                            ..S.a.t.o.s.h.i.L.a.b.s.                10.2.0        
  17.0  CTL    80 06 04 03  09 04 02 04                                                                                GET DESCRIPTOR                          11.1.0        
  17.0  IN     22 03 54 00  52 00 45 00  5a 00 4f 00  52 00 20 00  49 00 6e 00  74 00 65 00  72 00 66 00  61 00 63 00  ".T.R.E.Z.O.R. .I.n.t.e.r.f.a.c.        11.2.0        
               65 00                                                                                                   e.                                      11.2.32       
  18.0  CTL    80 06 03 03  09 04 02 04                                                                                GET DESCRIPTOR                          12.1.0        
  18.0  IN     32 03 32 00  34 00 45 00  32 00 32 00  46 00 41 00  46 00 35 00  35 00 45 00  36 00 30 00  37 00 45 00  2.2.4.E.2.2.F.A.F.5.5.E.6.0.7.E.        12.2.0        
               35 00 36 00  34 00 41 00  30 00 35 00  33 00 35 00  36 00                                               5.6.4.A.0.5.3.5.6.                      12.2.32       
  18.0  CTL    80 06 01 03  09 04 02 04                                                                                GET DESCRIPTOR                          13.1.0        
  18.0  IN     18 03 53 00  61 00 74 00  6f 00 73 00  68 00 69 00  4c 00 61 00  62 00 73 00                            ..S.a.t.o.s.h.i.L.a.b.s.                13.2.0        
  18.0  CTL    80 06 06 03  09 04 02 04                                                                                GET DESCRIPTOR                          14.1.0        
  18.0  IN     1c 03 55 00  32 00 46 00  20 00 49 00  6e 00 74 00  65 00 72 00  66 00 61 00  63 00 65 00               ..U.2.F. .I.n.t.e.r.f.a.c.e.            14.2.0        
  17.0  CTL    80 06 03 03  09 04 02 04                                                                                GET DESCRIPTOR                          15.1.0        
  17.0  IN     32 03 32 00  34 00 45 00  32 00 32 00  46 00 41 00  46 00 35 00  35 00 45 00  36 00 30 00  37 00 45 00  2.2.4.E.2.2.F.A.F.5.5.E.6.0.7.E.        15.2.0        
               35 00 36 00  34 00 41 00  30 00 35 00  33 00 35 00  36 00                                               5.6.4.A.0.5.3.5.6.                      15.2.32       
  17.0  CTL    80 06 01 03  09 04 02 04                                                                                GET DESCRIPTOR                          16.1.0        
  17.0  IN     18 03 53 00  61 00 74 00  6f 00 73 00  68 00 69 00  4c 00 61 00  62 00 73 00                            ..S.a.t.o.s.h.i.L.a.b.s.                16.2.0        
  17.0  CTL    80 06 04 03  09 04 02 04                                                                                GET DESCRIPTOR                          17.1.0        
  17.0  IN     22 03 54 00  52 00 45 00  5a 00 4f 00  52 00 20 00  49 00 6e 00  74 00 65 00  72 00 66 00  61 00 63 00  ".T.R.E.Z.O.R. .I.n.t.e.r.f.a.c.        17.2.0        
               65 00                                                                                                   e.                                      17.2.32       
  18.0  CTL    80 06 03 03  09 04 02 04                                                                                GET DESCRIPTOR                          18.1.0        
  18.0  IN     32 03 32 00  34 00 45 00  32 00 32 00  46 00 41 00  46 00 35 00  35 00 45 00  36 00 30 00  37 00 45 00  2.2.4.E.2.2.F.A.F.5.5.E.6.0.7.E.        18.2.0        
               35 00 36 00  34 00 41 00  30 00 35 00  33 00 35 00  36 00                                               5.6.4.A.0.5.3.5.6.                      18.2.32       
  18.0  CTL    80 06 01 03  09 04 02 04                                                                                GET DESCRIPTOR                          19.1.0        
  18.0  IN     18 03 53 00  61 00 74 00  6f 00 73 00  68 00 69 00  4c 00 61 00  62 00 73 00                            ..S.a.t.o.s.h.i.L.a.b.s.                19.2.0        
  18.0  CTL    80 06 06 03  09 04 02 04                                                                                GET DESCRIPTOR                          20.1.0        
  18.0  IN     1c 03 55 00  32 00 46 00  20 00 49 00  6e 00 74 00  65 00 72 00  66 00 61 00  63 00 65 00               ..U.2.F. .I.n.t.e.r.f.a.c.e.            20.2.0        
  17.1  OUT    3f ff ff ff  ff ff ff ff  ff ff ff ff  ff ff ff ff  ff ff ff ff  ff ff ff ff  ff ff ff ff  ff ff ff ff  ?...............................        21.1.0        
               ff ff ff ff  ff ff ff ff  ff ff ff ff  ff ff ff ff  ff ff ff ff  ff ff ff ff  ff ff ff ff  ff ff ff ff  ................................        21.1.32       
  17.1  OUT    3f 23 23 00  00 00 00 00  00 00 00 00  00 00 00 00  00 00 00 00  00 00 00 00  00 00 00 00  00 00 00 00  ?##.............................        22.1.0        
               00 00 00 00  00 00 00 00  00 00 00 00  00 00 00 00  00 00 00 00  00 00 00 00  00 00 00 00  00 00 00 00  ................................        22.1.32       
  17.1  IN     3f 23 23 00  11 00 00 00  8b 0a 11 62  69 74 63 6f  69 6e 74 72  65 7a 6f 72  2e 63 6f 6d  10 01 18 06  ?##........bitcointrezor.com....        23.1.0        
               20 02 32 18  32 34 45 32  32 46 41 46  35 35 45 36  30 37 45 35  36 34 41 30  35 33 35 36  38 01 40 00   .2.24E22FAF55E607E564A053568.@.        23.1.32       
  17.1  IN     3f 52 06 61  6e 64 72 65  77 60 01 6a  14 c9 11 3f  d3 f5 fc d7  8e 9e 56 0d  ba c7 5e d5  aa e3 59 eb  ?R.andrew`.j...?......V...^...Y.        24.1.0        
               2d 72 20 af  b4 cf 7a 4a  57 96 10 0e  d5 41 6b 75  12 1b c7 10  08 c2 a2 fd  54 49 bd 8f  63 cc 22 a6  -r ...zJW....Aku........TI..c.".        24.1.32       
  17.1  IN     3f a7 d6 80  78 00 80 01  00 88 01 00  98 01 00 a0  01 00 aa 01  01 31 00 00  00 00 00 00  00 00 00 00  ?...x................1..........        25.1.0        
               00 00 00 00  00 00 00 00  00 00 00 00  00 00 00 00  00 00 00 00  00 00 00 00  00 00 00 00  00 00 00 00  ................................        25.1.32       
  17.0  CTL    80 06 03 03  09 04 02 04                                                                                GET DESCRIPTOR                          26.1.0        
  17.0  IN     32 03 32 00  34 00 45 00  32 00 32 00  46 00 41 00  46 00 35 00  35 00 45 00  36 00 30 00  37 00 45 00  2.2.4.E.2.2.F.A.F.5.5.E.6.0.7.E.        26.2.0        
               35 00 36 00  34 00 41 00  30 00 35 00  33 00 35 00  36 00                                               5.6.4.A.0.5.3.5.6.                      26.2.32       
  17.0  CTL    80 06 01 03  09 04 02 04                                                                                GET DESCRIPTOR                          27.1.0        
  17.0  IN     18 03 53 00  61 00 74 00  6f 00 73 00  68 00 69 00  4c 00 61 00  62 00 73 00                            ..S.a.t.o.s.h.i.L.a.b.s.                27.2.0        
  17.0  CTL    80 06 04 03  09 04 02 04                                                                                GET DESCRIPTOR                          28.1.0        
  17.0  IN     22 03 54 00  52 00 45 00  5a 00 4f 00  52 00 20 00  49 00 6e 00  74 00 65 00  72 00 66 00  61 00 63 00  ".T.R.E.Z.O.R. .I.n.t.e.r.f.a.c.        28.2.0        
               65 00                                                                                                   e.                                      28.2.32       
  18.0  CTL    80 06 03 03  09 04 02 04                                                                                GET DESCRIPTOR                          29.1.0        
  18.0  IN     32 03 32 00  34 00 45 00  32 00 32 00  46 00 41 00  46 00 35 00  35 00 45 00  36 00 30 00  37 00 45 00  2.2.4.E.2.2.F.A.F.5.5.E.6.0.7.E.        29.2.0        
               35 00 36 00  34 00 41 00  30 00 35 00  33 00 35 00  36 00                                               5.6.4.A.0.5.3.5.6.                      29.2.32       
  18.0  CTL    80 06 01 03  09 04 02 04                                                                                GET DESCRIPTOR                          30.1.0        
  18.0  IN     18 03 53 00  61 00 74 00  6f 00 73 00  68 00 69 00  4c 00 61 00  62 00 73 00                            ..S.a.t.o.s.h.i.L.a.b.s.                30.2.0        
  18.0  CTL    80 06 06 03  09 04 02 04                                                                                GET DESCRIPTOR                          31.1.0        
  18.0  IN     1c 03 55 00  32 00 46 00  20 00 49 00  6e 00 74 00  65 00 72 00  66 00 61 00  63 00 65 00               ..U.2.F. .I.n.t.e.r.f.a.c.e.            31.2.0        
  17.1  OUT    3f ff ff ff  ff ff ff ff  ff ff ff ff  ff ff ff ff  ff ff ff ff  ff ff ff ff  ff ff ff ff  ff ff ff ff  ?...............................        32.1.0        
               ff ff ff ff  ff ff ff ff  ff ff ff ff  ff ff ff ff  ff ff ff ff  ff ff ff ff  ff ff ff ff  ff ff ff ff  ................................        32.1.32       
  17.1  OUT    3f 23 23 00  00 00 00 00  00 00 00 00  00 00 00 00  00 00 00 00  00 00 00 00  00 00 00 00  00 00 00 00  ?##.............................        33.1.0        
               00 00 00 00  00 00 00 00  00 00 00 00  00 00 00 00  00 00 00 00  00 00 00 00  00 00 00 00  00 00 00 00  ................................        33.1.32       
  17.1  IN     3f 23 23 00  11 00 00 00  8b 0a 11 62  69 74 63 6f  69 6e 74 72  65 7a 6f 72  2e 63 6f 6d  10 01 18 06  ?##........bitcointrezor.com....        34.1.0        
               20 02 32 18  32 34 45 32  32 46 41 46  35 35 45 36  30 37 45 35  36 34 41 30  35 33 35 36  38 01 40 00   .2.24E22FAF55E607E564A053568.@.        34.1.32       
  17.1  IN     3f 52 06 61  6e 64 72 65  77 60 01 6a  14 c9 11 3f  d3 f5 fc d7  8e 9e 56 0d  ba c7 5e d5  aa e3 59 eb  ?R.andrew`.j...?......V...^...Y.        35.1.0        
               2d 72 20 af  b4 cf 7a 4a  57 96 10 0e  d5 41 6b 75  12 1b c7 10  08 c2 a2 fd  54 49 bd 8f  63 cc 22 a6  -r ...zJW....Aku........TI..c.".        35.1.32       
  17.1  IN     3f a7 d6 80  78 00 80 01  00 88 01 00  98 01 00 a0  01 00 aa 01  01 31 00 00  00 00 00 00  00 00 00 00  ?...x................1..........        36.1.0        
               00 00 00 00  00 00 00 00  00 00 00 00  00 00 00 00  00 00 00 00  00 00 00 00  00 00 00 00  00 00 00 00  ................................        36.1.32       
  17.0  CTL    80 06 03 03  09 04 02 04                                                                                GET DESCRIPTOR                          37.1.0        
  17.0  IN     32 03 32 00  34 00 45 00  32 00 32 00  46 00 41 00  46 00 35 00  35 00 45 00  36 00 30 00  37 00 45 00  2.2.4.E.2.2.F.A.F.5.5.E.6.0.7.E.        37.2.0        
               35 00 36 00  34 00 41 00  30 00 35 00  33 00 35 00  36 00                                               5.6.4.A.0.5.3.5.6.                      37.2.32       
  17.0  CTL    80 06 01 03  09 04 02 04                                                                                GET DESCRIPTOR                          38.1.0        
  17.0  IN     18 03 53 00  61 00 74 00  6f 00 73 00  68 00 69 00  4c 00 61 00  62 00 73 00                            ..S.a.t.o.s.h.i.L.a.b.s.                38.2.0        
  17.0  CTL    80 06 04 03  09 04 02 04                                                                                GET DESCRIPTOR                          39.1.0        
  17.0  IN     22 03 54 00  52 00 45 00  5a 00 4f 00  52 00 20 00  49 00 6e 00  74 00 65 00  72 00 66 00  61 00 63 00  ".T.R.E.Z.O.R. .I.n.t.e.r.f.a.c.        39.2.0        
               65 00                                                                                                   e.                                      39.2.32       
  18.0  CTL    80 06 03 03  09 04 02 04                                                                                GET DESCRIPTOR                          40.1.0        
  18.0  IN     32 03 32 00  34 00 45 00  32 00 32 00  46 00 41 00  46 00 35 00  35 00 45 00  36 00 30 00  37 00 45 00  2.2.4.E.2.2.F.A.F.5.5.E.6.0.7.E.        40.2.0        
               35 00 36 00  34 00 41 00  30 00 35 00  33 00 35 00  36 00                                               5.6.4.A.0.5.3.5.6.                      40.2.32       
  18.0  CTL    80 06 01 03  09 04 02 04                                                                                GET DESCRIPTOR                          41.1.0        
  18.0  IN     18 03 53 00  61 00 74 00  6f 00 73 00  68 00 69 00  4c 00 61 00  62 00 73 00                            ..S.a.t.o.s.h.i.L.a.b.s.                41.2.0        
  18.0  CTL    80 06 06 03  09 04 02 04                                                                                GET DESCRIPTOR                          42.1.0        
  18.0  IN     1c 03 55 00  32 00 46 00  20 00 49 00  6e 00 74 00  65 00 72 00  66 00 61 00  63 00 65 00               ..U.2.F. .I.n.t.e.r.f.a.c.e.            42.2.0        
  17.0  CTL    80 06 03 03  09 04 02 04                                                                                GET DESCRIPTOR                          43.1.0        
  17.0  IN     32 03 32 00  34 00 45 00  32 00 32 00  46 00 41 00  46 00 35 00  35 00 45 00  36 00 30 00  37 00 45 00  2.2.4.E.2.2.F.A.F.5.5.E.6.0.7.E.        43.2.0        
               35 00 36 00  34 00 41 00  30 00 35 00  33 00 35 00  36 00                                               5.6.4.A.0.5.3.5.6.                      43.2.32       
  17.0  CTL    80 06 01 03  09 04 02 04                                                                                GET DESCRIPTOR                          44.1.0        
  17.0  IN     18 03 53 00  61 00 74 00  6f 00 73 00  68 00 69 00  4c 00 61 00  62 00 73 00                            ..S.a.t.o.s.h.i.L.a.b.s.                44.2.0        
  17.0  CTL    80 06 04 03  09 04 02 04                                                                                GET DESCRIPTOR                          45.1.0        
  17.0  IN     22 03 54 00  52 00 45 00  5a 00 4f 00  52 00 20 00  49 00 6e 00  74 00 65 00  72 00 66 00  61 00 63 00  ".T.R.E.Z.O.R. .I.n.t.e.r.f.a.c.        45.2.0        
               65 00                                                                                                   e.                                      45.2.32       
  18.0  CTL    80 06 03 03  09 04 02 04                                                                                GET DESCRIPTOR                          46.1.0        
  18.0  IN     32 03 32 00  34 00 45 00  32 00 32 00  46 00 41 00  46 00 35 00  35 00 45 00  36 00 30 00  37 00 45 00  2.2.4.E.2.2.F.A.F.5.5.E.6.0.7.E.        46.2.0        
               35 00 36 00  34 00 41 00  30 00 35 00  33 00 35 00  36 00                                               5.6.4.A.0.5.3.5.6.                      46.2.32       
  18.0  CTL    80 06 01 03  09 04 02 04                                                                                GET DESCRIPTOR                          47.1.0        
  18.0  IN     18 03 53 00  61 00 74 00  6f 00 73 00  68 00 69 00  4c 00 61 00  62 00 73 00                            ..S.a.t.o.s.h.i.L.a.b.s.                47.2.0        
  18.0  CTL    80 06 06 03  09 04 02 04                                                                                GET DESCRIPTOR                          48.1.0        
  18.0  IN     1c 03 55 00  32 00 46 00  20 00 49 00  6e 00 74 00  65 00 72 00  66 00 61 00  63 00 65 00               ..U.2.F. .I.n.t.e.r.f.a.c.e.            48.2.0        
  17.0  CTL    80 06 03 03  09 04 02 04                                                                                GET DESCRIPTOR                          49.1.0        
  17.0  IN     32 03 32 00  34 00 45 00  32 00 32 00  46 00 41 00  46 00 35 00  35 00 45 00  36 00 30 00  37 00 45 00  2.2.4.E.2.2.F.A.F.5.5.E.6.0.7.E.        49.2.0        
               35 00 36 00  34 00 41 00  30 00 35 00  33 00 35 00  36 00                                               5.6.4.A.0.5.3.5.6.                      49.2.32       
  17.0  CTL    80 06 01 03  09 04 02 04                                                                                GET DESCRIPTOR                          50.1.0        
  17.0  IN     18 03 53 00  61 00 74 00  6f 00 73 00  68 00 69 00  4c 00 61 00  62 00 73 00                            ..S.a.t.o.s.h.i.L.a.b.s.                50.2.0        
  17.0  CTL    80 06 04 03  09 04 02 04                                                                                GET DESCRIPTOR                          51.1.0        
  17.0  IN     22 03 54 00  52 00 45 00  5a 00 4f 00  52 00 20 00  49 00 6e 00  74 00 65 00  72 00 66 00  61 00 63 00  ".T.R.E.Z.O.R. .I.n.t.e.r.f.a.c.        51.2.0        
               65 00                                                                                                   e.                                      51.2.32       
  18.0  CTL    80 06 03 03  09 04 02 04                                                                                GET DESCRIPTOR                          52.1.0        
  18.0  IN     32 03 32 00  34 00 45 00  32 00 32 00  46 00 41 00  46 00 35 00  35 00 45 00  36 00 30 00  37 00 45 00  2.2.4.E.2.2.F.A.F.5.5.E.6.0.7.E.        52.2.0        
               35 00 36 00  34 00 41 00  30 00 35 00  33 00 35 00  36 00                                               5.6.4.A.0.5.3.5.6.                      52.2.32       
  18.0  CTL    80 06 01 03  09 04 02 04                                                                                GET DESCRIPTOR                          53.1.0        
  18.0  IN     18 03 53 00  61 00 74 00  6f 00 73 00  68 00 69 00  4c 00 61 00  62 00 73 00                            ..S.a.t.o.s.h.i.L.a.b.s.                53.2.0        
  18.0  CTL    80 06 06 03  09 04 02 04                                                                                GET DESCRIPTOR                          54.1.0        
  18.0  IN     1c 03 55 00  32 00 46 00  20 00 49 00  6e 00 74 00  65 00 72 00  66 00 61 00  63 00 65 00               ..U.2.F. .I.n.t.e.r.f.a.c.e.            54.2.0        
  17.0  CTL    80 06 03 03  09 04 02 04                                                                                GET DESCRIPTOR                          55.1.0        
  17.0  IN     32 03 32 00  34 00 45 00  32 00 32 00  46 00 41 00  46 00 35 00  35 00 45 00  36 00 30 00  37 00 45 00  2.2.4.E.2.2.F.A.F.5.5.E.6.0.7.E.        55.2.0        
               35 00 36 00  34 00 41 00  30 00 35 00  33 00 35 00  36 00                                               5.6.4.A.0.5.3.5.6.                      55.2.32       
  17.0  CTL    80 06 01 03  09 04 02 04                                                                                GET DESCRIPTOR                          56.1.0        
  17.0  IN     18 03 53 00  61 00 74 00  6f 00 73 00  68 00 69 00  4c 00 61 00  62 00 73 00                            ..S.a.t.o.s.h.i.L.a.b.s.                56.2.0        
  17.0  CTL    80 06 04 03  09 04 02 04                                                                                GET DESCRIPTOR                          57.1.0        
  17.0  IN     22 03 54 00  52 00 45 00  5a 00 4f 00  52 00 20 00  49 00 6e 00  74 00 65 00  72 00 66 00  61 00 63 00  ".T.R.E.Z.O.R. .I.n.t.e.r.f.a.c.        57.2.0        
               65 00                                                                                                   e.                                      57.2.32       
  18.0  CTL    80 06 03 03  09 04 02 04                                                                                GET DESCRIPTOR                          58.1.0        
  18.0  IN     32 03 32 00  34 00 45 00  32 00 32 00  46 00 41 00  46 00 35 00  35 00 45 00  36 00 30 00  37 00 45 00  2.2.4.E.2.2.F.A.F.5.5.E.6.0.7.E.        58.2.0        
               35 00 36 00  34 00 41 00  30 00 35 00  33 00 35 00  36 00                                               5.6.4.A.0.5.3.5.6.                      58.2.32       
  18.0  CTL    80 06 01 03  09 04 02 04                                                                                GET DESCRIPTOR                          59.1.0        
  18.0  IN     18 03 53 00  61 00 74 00  6f 00 73 00  68 00 69 00  4c 00 61 00  62 00 73 00                            ..S.a.t.o.s.h.i.L.a.b.s.                59.2.0        
  18.0  CTL    80 06 06 03  09 04 02 04                                                                                GET DESCRIPTOR                          60.1.0        
  18.0  IN     1c 03 55 00  32 00 46 00  20 00 49 00  6e 00 74 00  65 00 72 00  66 00 61 00  63 00 65 00               ..U.2.F. .I.n.t.e.r.f.a.c.e.            60.2.0        
  17.1  OUT    3f 23 23 00  0b 00 00 00  1b 08 b1 80  80 80 08 08  80 80 80 80  08 08 80 80  80 80 08 22  07 42 69 74  ?##........................".Bit        61.1.0        
               63 6f 69 6e  00 00 00 00  00 00 00 00  00 00 00 00  00 00 00 00  00 00 00 00  00 00 00 00  00 00 00 00  coin............................        61.1.32       
  17.1  IN     3f 23 23 00  12 00 00 00  02 08 01 00  00 00 00 00  00 00 00 00  00 00 00 00  00 00 00 00  00 00 00 00  ?##.............................        62.1.0        
               00 00 00 00  00 00 00 00  00 00 00 00  00 00 00 00  00 00 00 00  00 00 00 00  00 00 00 00  00 00 00 00  ................................        62.1.32       
  17.0  CTL    80 06 03 03  09 04 02 04                                                                                GET DESCRIPTOR                          63.1.0        
  17.0  IN     32 03 32 00  34 00 45 00  32 00 32 00  46 00 41 00  46 00 35 00  35 00 45 00  36 00 30 00  37 00 45 00  2.2.4.E.2.2.F.A.F.5.5.E.6.0.7.E.        63.2.0        
               35 00 36 00  34 00 41 00  30 00 35 00  33 00 35 00  36 00                                               5.6.4.A.0.5.3.5.6.                      63.2.32       
  17.0  CTL    80 06 01 03  09 04 02 04                                                                                GET DESCRIPTOR                          64.1.0        
  17.0  IN     18 03 53 00  61 00 74 00  6f 00 73 00  68 00 69 00  4c 00 61 00  62 00 73 00                            ..S.a.t.o.s.h.i.L.a.b.s.                64.2.0        
  17.0  CTL    80 06 04 03  09 04 02 04                                                                                GET DESCRIPTOR                          65.1.0        
  17.0  IN     22 03 54 00  52 00 45 00  5a 00 4f 00  52 00 20 00  49 00 6e 00  74 00 65 00  72 00 66 00  61 00 63 00  ".T.R.E.Z.O.R. .I.n.t.e.r.f.a.c.        65.2.0        
               65 00                                                                                                   e.                                      65.2.32       
  18.0  CTL    80 06 03 03  09 04 02 04                                                                                GET DESCRIPTOR                          66.1.0        
  18.0  IN     32 03 32 00  34 00 45 00  32 00 32 00  46 00 41 00  46 00 35 00  35 00 45 00  36 00 30 00  37 00 45 00  2.2.4.E.2.2.F.A.F.5.5.E.6.0.7.E.        66.2.0        
               35 00 36 00  34 00 41 00  30 00 35 00  33 00 35 00  36 00                                               5.6.4.A.0.5.3.5.6.                      66.2.32       
  18.0  CTL    80 06 01 03  09 04 02 04                                                                                GET DESCRIPTOR                          67.1.0        
  18.0  IN     18 03 53 00  61 00 74 00  6f 00 73 00  68 00 69 00  4c 00 61 00  62 00 73 00                            ..S.a.t.o.s.h.i.L.a.b.s.                67.2.0        
  18.0  CTL    80 06 06 03  09 04 02 04                                                                                GET DESCRIPTOR                          68.1.0        
  18.0  IN     1c 03 55 00  32 00 46 00  20 00 49 00  6e 00 74 00  65 00 72 00  66 00 61 00  63 00 65 00               ..U.2.F. .I.n.t.e.r.f.a.c.e.            68.2.0        
  17.0  CTL    80 06 03 03  09 04 02 04                                                                                GET DESCRIPTOR                          69.1.0        
  17.0  IN     32 03 32 00  34 00 45 00  32 00 32 00  46 00 41 00  46 00 35 00  35 00 45 00  36 00 30 00  37 00 45 00  2.2.4.E.2.2.F.A.F.5.5.E.6.0.7.E.        69.2.0        
               35 00 36 00  34 00 41 00  30 00 35 00  33 00 35 00  36 00                                               5.6.4.A.0.5.3.5.6.                      69.2.32       
  17.0  CTL    80 06 01 03  09 04 02 04                                                                                GET DESCRIPTOR                          70.1.0        
  17.0  IN     18 03 53 00  61 00 74 00  6f 00 73 00  68 00 69 00  4c 00 61 00  62 00 73 00                            ..S.a.t.o.s.h.i.L.a.b.s.                70.2.0        
  17.0  CTL    80 06 04 03  09 04 02 04                                                                                GET DESCRIPTOR                          71.1.0        
  17.0  IN     22 03 54 00  52 00 45 00  5a 00 4f 00  52 00 20 00  49 00 6e 00  74 00 65 00  72 00 66 00  61 00 63 00  ".T.R.E.Z.O.R. .I.n.t.e.r.f.a.c.        71.2.0        
               65 00                                                                                                   e.                                      71.2.32       
  18.0  CTL    80 06 03 03  09 04 02 04                                                                                GET DESCRIPTOR                          72.1.0        
  18.0  IN     32 03 32 00  34 00 45 00  32 00 32 00  46 00 41 00  46 00 35 00  35 00 45 00  36 00 30 00  37 00 45 00  2.2.4.E.2.2.F.A.F.5.5.E.6.0.7.E.        72.2.0        
               35 00 36 00  34 00 41 00  30 00 35 00  33 00 35 00  36 00                                               5.6.4.A.0.5.3.5.6.                      72.2.32       
  18.0  CTL    80 06 01 03  09 04 02 04                                                                                GET DESCRIPTOR                          73.1.0        
  18.0  IN     18 03 53 00  61 00 74 00  6f 00 73 00  68 00 69 00  4c 00 61 00  62 00 73 00                            ..S.a.t.o.s.h.i.L.a.b.s.                73.2.0        
  18.0  CTL    80 06 06 03  09 04 02 04                                                                                GET DESCRIPTOR                          74.1.0        
  18.0  IN     1c 03 55 00  32 00 46 00  20 00 49 00  6e 00 74 00  65 00 72 00  66 00 61 00  63 00 65 00               ..U.2.F. .I.n.t.e.r.f.a.c.e.            74.2.0        
  17.0  CTL    80 06 03 03  09 04 02 04                                                                                GET DESCRIPTOR                          75.1.0        
  17.0  IN     32 03 32 00  34 00 45 00  32 00 32 00  46 00 41 00  46 00 35 00  35 00 45 00  36 00 30 00  37 00 45 00  2.2.4.E.2.2.F.A.F.5.5.E.6.0.7.E.        75.2.0        
               35 00 36 00  34 00 41 00  30 00 35 00  33 00 35 00  36 00                                               5.6.4.A.0.5.3.5.6.                      75.2.32       
  17.0  CTL    80 06 01 03  09 04 02 04                                                                                GET DESCRIPTOR                          76.1.0        
  17.0  IN     18 03 53 00  61 00 74 00  6f 00 73 00  68 00 69 00  4c 00 61 00  62 00 73 00                            ..S.a.t.o.s.h.i.L.a.b.s.                76.2.0        
  17.0  CTL    80 06 04 03  09 04 02 04                                                                                GET DESCRIPTOR                          77.1.0        
  17.0  IN     22 03 54 00  52 00 45 00  5a 00 4f 00  52 00 20 00  49 00 6e 00  74 00 65 00  72 00 66 00  61 00 63 00  ".T.R.E.Z.O.R. .I.n.t.e.r.f.a.c.        77.2.0        
               65 00                                                                                                   e.                                      77.2.32       
  18.0  CTL    80 06 03 03  09 04 02 04                                                                                GET DESCRIPTOR                          78.1.0        
  18.0  IN     32 03 32 00  34 00 45 00  32 00 32 00  46 00 41 00  46 00 35 00  35 00 45 00  36 00 30 00  37 00 45 00  2.2.4.E.2.2.F.A.F.5.5.E.6.0.7.E.        78.2.0        
               35 00 36 00  34 00 41 00  30 00 35 00  33 00 35 00  36 00                                               5.6.4.A.0.5.3.5.6.                      78.2.32       
  18.0  CTL    80 06 01 03  09 04 02 04                                                                                GET DESCRIPTOR                          79.1.0        
  18.0  IN     18 03 53 00  61 00 74 00  6f 00 73 00  68 00 69 00  4c 00 61 00  62 00 73 00                            ..S.a.t.o.s.h.i.L.a.b.s.                79.2.0        
  18.0  CTL    80 06 06 03  09 04 02 04                                                                                GET DESCRIPTOR                          80.1.0        
  18.0  IN     1c 03 55 00  32 00 46 00  20 00 49 00  6e 00 74 00  65 00 72 00  66 00 61 00  63 00 65 00               ..U.2.F. .I.n.t.e.r.f.a.c.e.            80.2.0        
  17.0  CTL    80 06 03 03  09 04 02 04                                                                                GET DESCRIPTOR                          81.1.0        
  17.0  IN     32 03 32 00  34 00 45 00  32 00 32 00  46 00 41 00  46 00 35 00  35 00 45 00  36 00 30 00  37 00 45 00  2.2.4.E.2.2.F.A.F.5.5.E.6.0.7.E.        81.2.0        
               35 00 36 00  34 00 41 00  30 00 35 00  33 00 35 00  36 00                                               5.6.4.A.0.5.3.5.6.                      81.2.32       
  17.0  CTL    80 06 01 03  09 04 02 04                                                                                GET DESCRIPTOR                          82.1.0        
  17.0  IN     18 03 53 00  61 00 74 00  6f 00 73 00  68 00 69 00  4c 00 61 00  62 00 73 00                            ..S.a.t.o.s.h.i.L.a.b.s.                82.2.0        
  17.0  CTL    80 06 04 03  09 04 02 04                                                                                GET DESCRIPTOR                          83.1.0        
  17.0  IN     22 03 54 00  52 00 45 00  5a 00 4f 00  52 00 20 00  49 00 6e 00  74 00 65 00  72 00 66 00  61 00 63 00  ".T.R.E.Z.O.R. .I.n.t.e.r.f.a.c.        83.2.0        
               65 00                                                                                                   e.                                      83.2.32       
  18.0  CTL    80 06 03 03  09 04 02 04                                                                                GET DESCRIPTOR                          84.1.0        
  18.0  IN     32 03 32 00  34 00 45 00  32 00 32 00  46 00 41 00  46 00 35 00  35 00 45 00  36 00 30 00  37 00 45 00  2.2.4.E.2.2.F.A.F.5.5.E.6.0.7.E.        84.2.0        
               35 00 36 00  34 00 41 00  30 00 35 00  33 00 35 00  36 00                                               5.6.4.A.0.5.3.5.6.                      84.2.32       
  18.0  CTL    80 06 01 03  09 04 02 04                                                                                GET DESCRIPTOR                          85.1.0        
  18.0  IN     18 03 53 00  61 00 74 00  6f 00 73 00  68 00 69 00  4c 00 61 00  62 00 73 00                            ..S.a.t.o.s.h.i.L.a.b.s.                85.2.0        
  18.0  CTL    80 06 06 03  09 04 02 04                                                                                GET DESCRIPTOR                          86.1.0        
  18.0  IN     1c 03 55 00  32 00 46 00  20 00 49 00  6e 00 74 00  65 00 72 00  66 00 61 00  63 00 65 00               ..U.2.F. .I.n.t.e.r.f.a.c.e.            86.2.0        
  17.0  CTL    80 06 03 03  09 04 02 04                                                                                GET DESCRIPTOR                          87.1.0        
  17.0  IN     32 03 32 00  34 00 45 00  32 00 32 00  46 00 41 00  46 00 35 00  35 00 45 00  36 00 30 00  37 00 45 00  2.2.4.E.2.2.F.A.F.5.5.E.6.0.7.E.        87.2.0        
               35 00 36 00  34 00 41 00  30 00 35 00  33 00 35 00  36 00                                               5.6.4.A.0.5.3.5.6.                      87.2.32       
  17.0  CTL    80 06 01 03  09 04 02 04                                                                                GET DESCRIPTOR                          88.1.0        
  17.0  IN     18 03 53 00  61 00 74 00  6f 00 73 00  68 00 69 00  4c 00 61 00  62 00 73 00                            ..S.a.t.o.s.h.i.L.a.b.s.                88.2.0        
  17.0  CTL    80 06 04 03  09 04 02 04                                                                                GET DESCRIPTOR                          89.1.0        
  17.0  IN     22 03 54 00  52 00 45 00  5a 00 4f 00  52 00 20 00  49 00 6e 00  74 00 65 00  72 00 66 00  61 00 63 00  ".T.R.E.Z.O.R. .I.n.t.e.r.f.a.c.        89.2.0        
               65 00                                                                                                   e.                                      89.2.32       
  18.0  CTL    80 06 03 03  09 04 02 04                                                                                GET DESCRIPTOR                          90.1.0        
  18.0  IN     32 03 32 00  34 00 45 00  32 00 32 00  46 00 41 00  46 00 35 00  35 00 45 00  36 00 30 00  37 00 45 00  2.2.4.E.2.2.F.A.F.5.5.E.6.0.7.E.        90.2.0        
               35 00 36 00  34 00 41 00  30 00 35 00  33 00 35 00  36 00                                               5.6.4.A.0.5.3.5.6.                      90.2.32       
  18.0  CTL    80 06 01 03  09 04 02 04                                                                                GET DESCRIPTOR                          91.1.0        
  18.0  IN     18 03 53 00  61 00 74 00  6f 00 73 00  68 00 69 00  4c 00 61 00  62 00 73 00                            ..S.a.t.o.s.h.i.L.a.b.s.                91.2.0        
  18.0  CTL    80 06 06 03  09 04 02 04                                                                                GET DESCRIPTOR                          92.1.0        
  18.0  IN     1c 03 55 00  32 00 46 00  20 00 49 00  6e 00 74 00  65 00 72 00  66 00 61 00  63 00 65 00               ..U.2.F. .I.n.t.e.r.f.a.c.e.            92.2.0        
  17.1  OUT    3f 23 23 00  13 00 00 00  03 0a 01 32  00 00 00 00  00 00 00 00  00 00 00 00  00 00 00 00  00 00 00 00  ?##........2....................        93.1.0        
               00 00 00 00  00 00 00 00  00 00 00 00  00 00 00 00  00 00 00 00  00 00 00 00  00 00 00 00  00 00 00 00  ................................        93.1.32       
  17.1  IN     3f 23 23 00  0c 00 00 00  c6 0a 53 08  03 10 92 b3  b9 b6 0b 18  80 80 80 80  08 22 20 cc  9f 61 a7 44  ?##.......S.............." ..a.D        94.1.0        
               9e be 32 06  ed 45 b1 1c  64 f7 6a 2a  10 63 02 b9  06 15 ef 10  38 d2 36 6e  94 33 a4 32  21 02 04 fe  ..2..E..d.j*.c......8.6n.3.2!...        94.1.32       
  17.1  IN     3f 7d e6 76  b5 b4 ff 40  27 c6 72 18  90 2c 58 ba  75 23 38 f4  c7 c0 61 2e  ed cc 08 90  64 24 2f 12  ?..v...@'.r..,X.u#8...a.....d$/.        95.1.0        
               6f 78 70 75  62 36 43 7a  68 63 53 50  73 73 64 7a  44 52 75 46  31 64 4e 45  77 33 4d 78  77 51 50 53  oxpub6CzhcSPssdzDRuF1dNEw3MxwQPS        95.1.32       
  17.1  IN     3f 65 51 65  56 4d 75 34  43 7a 43 62  56 72 6e 6e  72 61 6f 76  79 48 4b 6a  50 56 65 31  55 55 68 36  ?eQeVMu4CzCbVrnnraovyHKjPVe1UUh6        96.1.0        
               55 32 33 32  4b 63 51 4d  54 36 6b 39  50 39 46 58  42 71 75 75  61 54 50 50  47 62 4c 4c  57 66 4e 48  U232KcQMT6k9P9FXBquuaTPPGbLLWfNH        96.1.32       
  17.1  IN     3f 76 34 31  41 72 42 33  79 46 33 44  72 65 31 48  76 70 00 00  00 00 00 00  00 00 00 00  00 00 00 00  ?v41ArB3yF3Dre1Hvp..............        97.1.0        
               00 00 00 00  00 00 00 00  00 00 00 00  00 00 00 00  00 00 00 00  00 00 00 00  00 00 00 00  00 00 00 00  ................................        97.1.32       
  17.1  OUT    3f 23 23 00  0b 00 00 00  1d 08 b1 80  80 80 08 08  80 80 80 80  08 08 80 80  80 80 08 08  00 22 07 42  ?##..........................".B        98.1.0        
               69 74 63 6f  69 6e 00 00  00 00 00 00  00 00 00 00  00 00 00 00  00 00 00 00  00 00 00 00  00 00 00 00  itcoin..........................        98.1.32       
  17.1  IN     3f 23 23 00  0c 00 00 00  c2 0a 4f 08  04 10 85 f5  91 b6 04 18  00 22 20 de  a0 67 87 cd  a5 28 c4 52  ?##.......O.........." ..g...(.R        99.1.0        
               eb 6c 29 16  de 32 2a 8e  3e 9e d0 64  7d 54 37 82  1c 48 c9 08  76 7d ff 32  21 02 e6 5a  61 de 0d 8d  .l)..2*.>..d.T7..H..v..2!..Za...        99.1.32       
  17.1  IN     3f f0 25 11  e0 15 c0 42  8f f5 7e 5f  e4 15 1a 8d  1c 42 4c fe  6f 8a 66 27  65 24 3c 12  6f 78 70 75  ?.%....B..._.....BL.o.f'e$<.oxpu       100.1.0        
               62 36 45 34  35 43 6d 59  42 57 66 67  65 37 65 46  45 64 38 68  32 75 37 56  33 6a 38 35  33 71 44 70  b6E45CmYBWfge7eFEd8h2u7V3j853qDp       100.1.32       
  17.1  IN     3f 32 48 4d  7a 36 61 59  46 79 79 6f  6a 47 57 6b  52 69 4a 57  54 71 37 51  6d 62 68 73  77 73 57 79  ?2HMz6aYFyyojGWkRiJWTq7QmbhswsWy       101.1.0        
               50 33 58 47  4e 62 33 48  50 4c 45 41  61 59 41 32  64 4a 56 6b  36 52 4a 37  56 68 72 68  42 4e 6a 6f  P3XGNb3HPLEAaYA2dJVk6RJ7VhrhBNjo       101.1.32       
  17.1  IN     3f 73 74 5a  50 53 41 72  57 65 69 4a  55 55 00 00  00 00 00 00  00 00 00 00  00 00 00 00  00 00 00 00  ?stZPSArWeiJUU..................       102.1.0        
               00 00 00 00  00 00 00 00  00 00 00 00  00 00 00 00  00 00 00 00  00 00 00 00  00 00 00 00  00 00 00 00  ................................       102.1.32       
  17.1  OUT    3f 23 23 00  0b 00 00 00  1d 08 ac 80  80 80 08 08  81 80 80 80  08 08 80 80  80 80 08 08  00 22 07 42  ?##..........................".B       103.1.0        
               69 74 63 6f  69 6e 00 00  00 00 00 00  00 00 00 00  00 00 00 00  00 00 00 00  00 00 00 00  00 00 00 00  itcoin..........................       103.1.32       
  17.1  IN     3f 23 23 00  0c 00 00 00  c2 0a 4f 08  04 10 f3 f6  d5 ad 08 18  00 22 20 50  7c 8c 0e e6  2d 8d f9 b4  ?##.......O.........." P....-...       104.1.0        
               69 1d b8 86  b4 22 6d e5  ff 64 f4 78  4a 26 07 cc  11 6f c1 4b  5f 88 33 32  21 03 46 53  23 a0 15 0d  i...."m..d.xJ&...o.K_.32!.FS#...       104.1.32       
  17.1  IN     3f 44 6e d6  ed 10 bd 55  03 95 b0 93  9f eb 58 aa  5b 9e b6 2f  1f a0 59 14  ef 58 38 12  6f 78 70 75  ?Dn....U......X.[../..Y..X8.oxpu       105.1.0        
               62 36 45 57  75 56 62 61  48 37 51 50  61 6d 71 4d  4b 67 58 58  63 50 50 43  48 79 32 56  5a 33 78 6e  b6EWuVbaH7QPamqMKgXXcPPCHy2VZ3xn       105.1.32       
  17.1  IN     3f 5a 4c 6e  5a 44 41 61  4e 46 78 42  4c 4b 55 73  64 70 63 58  79 7a 6d 35  7a 62 61 58  57 45 78 51  ?ZLnZDAaNFxBLKUsdpcXyzm5zbaXWExQ       106.1.0        
               45 67 7a 35  39 67 67 42  45 4a 5a 46  7a 55 6d 6f  45 6b 6f 77  4a 48 53 66  56 42 4e 50  64 34 64 38  Egz59ggBEJZFzUmoEkowJHSfVBNPd4d8       106.1.32       
  17.1  IN     3f 65 36 59  69 5a 77 35  4d 7a 77 41  4a 70 00 00  00 00 00 00  00 00 00 00  00 00 00 00  00 00 00 00  ?e6YiZw5MzwAJp..................       107.1.0        
               00 00 00 00  00 00 00 00  00 00 00 00  00 00 00 00  00 00 00 00  00 00 00 00  00 00 00 00  00 00 00 00  ................................       107.1.32       
  17.0  CTL    80 06 03 03  09 04 02 04                                                                                GET DESCRIPTOR                         108.1.0        
  17.0  IN     32 03 32 00  34 00 45 00  32 00 32 00  46 00 41 00  46 00 35 00  35 00 45 00  36 00 30 00  37 00 45 00  2.2.4.E.2.2.F.A.F.5.5.E.6.0.7.E.       108.2.0        
               35 00 36 00  34 00 41 00  30 00 35 00  33 00 35 00  36 00                                               5.6.4.A.0.5.3.5.6.                     108.2.32       
  17.0  CTL    80 06 01 03  09 04 02 04                                                                                GET DESCRIPTOR                         109.1.0        
  17.0  IN     18 03 53 00  61 00 74 00  6f 00 73 00  68 00 69 00  4c 00 61 00  62 00 73 00                            ..S.a.t.o.s.h.i.L.a.b.s.               109.2.0        
  17.0  CTL    80 06 04 03  09 04 02 04                                                                                GET DESCRIPTOR                         110.1.0        
  17.0  IN     22 03 54 00  52 00 45 00  5a 00 4f 00  52 00 20 00  49 00 6e 00  74 00 65 00  72 00 66 00  61 00 63 00  ".T.R.E.Z.O.R. .I.n.t.e.r.f.a.c.       110.2.0        
               65 00                                                                                                   e.                                     110.2.32       
  18.0  CTL    80 06 03 03  09 04 02 04                                                                                GET DESCRIPTOR                         111.1.0        
  18.0  IN     32 03 32 00  34 00 45 00  32 00 32 00  46 00 41 00  46 00 35 00  35 00 45 00  36 00 30 00  37 00 45 00  2.2.4.E.2.2.F.A.F.5.5.E.6.0.7.E.       111.2.0        
               35 00 36 00  34 00 41 00  30 00 35 00  33 00 35 00  36 00                                               5.6.4.A.0.5.3.5.6.                     111.2.32       
  18.0  CTL    80 06 01 03  09 04 02 04                                                                                GET DESCRIPTOR                         112.1.0        
  18.0  IN     18 03 53 00  61 00 74 00  6f 00 73 00  68 00 69 00  4c 00 61 00  62 00 73 00                            ..S.a.t.o.s.h.i.L.a.b.s.               112.2.0        
  18.0  CTL    80 06 06 03  09 04 02 04                                                                                GET DESCRIPTOR                         113.1.0        
  18.0  IN     1c 03 55 00  32 00 46 00  20 00 49 00  6e 00 74 00  65 00 72 00  66 00 61 00  63 00 65 00               ..U.2.F. .I.n.t.e.r.f.a.c.e.           113.2.0        
  17.0  CTL    21 0a 00 00  00 00 00 00                                                                                SET IDLE                               114.1.0        
  18.0  CTL    21 0a 00 00  01 00 00 00                                                                                SET IDLE                               115.1.0        
  17.0  USTS   c0000004                                                                                                stall pid                              114.2.0        
  18.0  USTS   c0000004                                                                                                stall pid                              115.2.0        
  17.0  CTL    80 06 03 03  09 04 02 04                                                                                GET DESCRIPTOR                         116.1.0        
  17.0  IN     32 03 32 00  34 00 45 00  32 00 32 00  46 00 41 00  46 00 35 00  35 00 45 00  36 00 30 00  37 00 45 00  2.2.4.E.2.2.F.A.F.5.5.E.6.0.7.E.       116.2.0        
               35 00 36 00  34 00 41 00  30 00 35 00  33 00 35 00  36 00                                               5.6.4.A.0.5.3.5.6.                     116.2.32       
  17.0  CTL    80 06 01 03  09 04 02 04                                                                                GET DESCRIPTOR                         117.1.0        
  17.0  IN     18 03 53 00  61 00 74 00  6f 00 73 00  68 00 69 00  4c 00 61 00  62 00 73 00                            ..S.a.t.o.s.h.i.L.a.b.s.               117.2.0        
  17.0  CTL    80 06 04 03  09 04 02 04                                                                                GET DESCRIPTOR                         118.1.0        
  17.0  IN     22 03 54 00  52 00 45 00  5a 00 4f 00  52 00 20 00  49 00 6e 00  74 00 65 00  72 00 66 00  61 00 63 00  ".T.R.E.Z.O.R. .I.n.t.e.r.f.a.c.       118.2.0        
               65 00                                                                                                   e.                                     118.2.32       
  18.0  CTL    80 06 03 03  09 04 02 04                                                                                GET DESCRIPTOR                         119.1.0        
  18.0  IN     32 03 32 00  34 00 45 00  32 00 32 00  46 00 41 00  46 00 35 00  35 00 45 00  36 00 30 00  37 00 45 00  2.2.4.E.2.2.F.A.F.5.5.E.6.0.7.E.       119.2.0        
               35 00 36 00  34 00 41 00  30 00 35 00  33 00 35 00  36 00                                               5.6.4.A.0.5.3.5.6.                     119.2.32       
  18.0  CTL    80 06 01 03  09 04 02 04                                                                                GET DESCRIPTOR                         120.1.0        
  18.0  IN     18 03 53 00  61 00 74 00  6f 00 73 00  68 00 69 00  4c 00 61 00  62 00 73 00                            ..S.a.t.o.s.h.i.L.a.b.s.               120.2.0        
  18.0  CTL    80 06 06 03  09 04 02 04                                                                                GET DESCRIPTOR                         121.1.0        
  18.0  IN     1c 03 55 00  32 00 46 00  20 00 49 00  6e 00 74 00  65 00 72 00  66 00 61 00  63 00 65 00               ..U.2.F. .I.n.t.e.r.f.a.c.e.           121.2.0        
  17.0  CTL    80 06 03 03  09 04 02 04                                                                                GET DESCRIPTOR                         122.1.0        
  17.0  IN     32 03 32 00  34 00 45 00  32 00 32 00  46 00 41 00  46 00 35 00  35 00 45 00  36 00 30 00  37 00 45 00  2.2.4.E.2.2.F.A.F.5.5.E.6.0.7.E.       122.2.0        
               35 00 36 00  34 00 41 00  30 00 35 00  33 00 35 00  36 00                                               5.6.4.A.0.5.3.5.6.                     122.2.32       
  17.0  CTL    80 06 01 03  09 04 02 04                                                                                GET DESCRIPTOR                         123.1.0        
  17.0  IN     18 03 53 00  61 00 74 00  6f 00 73 00  68 00 69 00  4c 00 61 00  62 00 73 00                            ..S.a.t.o.s.h.i.L.a.b.s.               123.2.0        
  17.0  CTL    80 06 04 03  09 04 02 04                                                                                GET DESCRIPTOR                         124.1.0        
  17.0  IN     22 03 54 00  52 00 45 00  5a 00 4f 00  52 00 20 00  49 00 6e 00  74 00 65 00  72 00 66 00  61 00 63 00  ".T.R.E.Z.O.R. .I.n.t.e.r.f.a.c.       124.2.0        
               65 00                                                                                                   e.                                     124.2.32       
  18.0  CTL    80 06 03 03  09 04 02 04                                                                                GET DESCRIPTOR                         125.1.0        
  18.0  IN     32 03 32 00  34 00 45 00  32 00 32 00  46 00 41 00  46 00 35 00  35 00 45 00  36 00 30 00  37 00 45 00  2.2.4.E.2.2.F.A.F.5.5.E.6.0.7.E.       125.2.0        
               35 00 36 00  34 00 41 00  30 00 35 00  33 00 35 00  36 00                                               5.6.4.A.0.5.3.5.6.                     125.2.32       
  18.0  CTL    80 06 01 03  09 04 02 04                                                                                GET DESCRIPTOR                         126.1.0        
  18.0  IN     18 03 53 00  61 00 74 00  6f 00 73 00  68 00 69 00  4c 00 61 00  62 00 73 00                            ..S.a.t.o.s.h.i.L.a.b.s.               126.2.0        
  18.0  CTL    80 06 06 03  09 04 02 04                                                                                GET DESCRIPTOR                         127.1.0        
  18.0  IN     1c 03 55 00  32 00 46 00  20 00 49 00  6e 00 74 00  65 00 72 00  66 00 61 00  63 00 65 00               ..U.2.F. .I.n.t.e.r.f.a.c.e.           127.2.0        
  17.0  CTL    80 06 03 03  09 04 02 04                                                                                GET DESCRIPTOR                         128.1.0        
  17.0  IN     32 03 32 00  34 00 45 00  32 00 32 00  46 00 41 00  46 00 35 00  35 00 45 00  36 00 30 00  37 00 45 00  2.2.4.E.2.2.F.A.F.5.5.E.6.0.7.E.       128.2.0        
               35 00 36 00  34 00 41 00  30 00 35 00  33 00 35 00  36 00                                               5.6.4.A.0.5.3.5.6.                     128.2.32       
  17.0  CTL    80 06 01 03  09 04 02 04                                                                                GET DESCRIPTOR                         129.1.0        
  17.0  IN     18 03 53 00  61 00 74 00  6f 00 73 00  68 00 69 00  4c 00 61 00  62 00 73 00                            ..S.a.t.o.s.h.i.L.a.b.s.               129.2.0        
  17.0  CTL    80 06 04 03  09 04 02 04                                                                                GET DESCRIPTOR                         130.1.0        
  17.0  IN     22 03 54 00  52 00 45 00  5a 00 4f 00  52 00 20 00  49 00 6e 00  74 00 65 00  72 00 66 00  61 00 63 00  ".T.R.E.Z.O.R. .I.n.t.e.r.f.a.c.       130.2.0        
               65 00                                                                                                   e.                                     130.2.32       
  18.0  CTL    80 06 03 03  09 04 02 04                                                                                GET DESCRIPTOR                         131.1.0        
  18.0  IN     32 03 32 00  34 00 45 00  32 00 32 00  46 00 41 00  46 00 35 00  35 00 45 00  36 00 30 00  37 00 45 00  2.2.4.E.2.2.F.A.F.5.5.E.6.0.7.E.       131.2.0        
               35 00 36 00  34 00 41 00  30 00 35 00  33 00 35 00  36 00                                               5.6.4.A.0.5.3.5.6.                     131.2.32       
  18.0  CTL    80 06 01 03  09 04 02 04                                                                                GET DESCRIPTOR                         132.1.0        
  18.0  IN     18 03 53 00  61 00 74 00  6f 00 73 00  68 00 69 00  4c 00 61 00  62 00 73 00                            ..S.a.t.o.s.h.i.L.a.b.s.               132.2.0        
  18.0  CTL    80 06 06 03  09 04 02 04                                                                                GET DESCRIPTOR                         133.1.0        
  18.0  IN     1c 03 55 00  32 00 46 00  20 00 49 00  6e 00 74 00  65 00 72 00  66 00 61 00  63 00 65 00               ..U.2.F. .I.n.t.e.r.f.a.c.e.           133.2.0        
  17.1  OUT    3f ff ff ff  ff ff ff ff  ff ff ff ff  ff ff ff ff  ff ff ff ff  ff ff ff ff  ff ff ff ff  ff ff ff ff  ?...............................       134.1.0        
               ff ff ff ff  ff ff ff ff  ff ff ff ff  ff ff ff ff  ff ff ff ff  ff ff ff ff  ff ff ff ff  ff ff ff ff  ................................       134.1.32       
  17.1  OUT    3f 23 23 00  00 00 00 00  00 00 00 00  00 00 00 00  00 00 00 00  00 00 00 00  00 00 00 00  00 00 00 00  ?##.............................       135.1.0        
               00 00 00 00  00 00 00 00  00 00 00 00  00 00 00 00  00 00 00 00  00 00 00 00  00 00 00 00  00 00 00 00  ................................       135.1.32       
  17.1  IN     3f 23 23 00  11 00 00 00  8b 0a 11 62  69 74 63 6f  69 6e 74 72  65 7a 6f 72  2e 63 6f 6d  10 01 18 06  ?##........bitcointrezor.com....       136.1.0        
               20 02 32 18  32 34 45 32  32 46 41 46  35 35 45 36  30 37 45 35  36 34 41 30  35 33 35 36  38 01 40 00   .2.24E22FAF55E607E564A053568.@.       136.1.32       
  17.1  IN     3f 52 06 61  6e 64 72 65  77 60 01 6a  14 c9 11 3f  d3 f5 fc d7  8e 9e 56 0d  ba c7 5e d5  aa e3 59 eb  ?R.andrew`.j...?......V...^...Y.       137.1.0        
               2d 72 20 af  b4 cf 7a 4a  57 96 10 0e  d5 41 6b 75  12 1b c7 10  08 c2 a2 fd  54 49 bd 8f  63 cc 22 a6  -r ...zJW....Aku........TI..c.".       137.1.32       
  17.1  IN     3f a7 d6 80  78 00 80 01  01 88 01 00  98 01 00 a0  01 00 aa 01  01 31 00 00  00 00 00 00  00 00 00 00  ?...x................1..........       138.1.0        
               00 00 00 00  00 00 00 00  00 00 00 00  00 00 00 00  00 00 00 00  00 00 00 00  00 00 00 00  00 00 00 00  ................................       138.1.32       
  17.0  CTL    80 06 03 03  09 04 02 04                                                                                GET DESCRIPTOR                         139.1.0        
  17.0  IN     32 03 32 00  34 00 45 00  32 00 32 00  46 00 41 00  46 00 35 00  35 00 45 00  36 00 30 00  37 00 45 00  2.2.4.E.2.2.F.A.F.5.5.E.6.0.7.E.       139.2.0        
               35 00 36 00  34 00 41 00  30 00 35 00  33 00 35 00  36 00                                               5.6.4.A.0.5.3.5.6.                     139.2.32       
  17.0  CTL    80 06 01 03  09 04 02 04                                                                                GET DESCRIPTOR                         140.1.0        
  17.0  IN     18 03 53 00  61 00 74 00  6f 00 73 00  68 00 69 00  4c 00 61 00  62 00 73 00                            ..S.a.t.o.s.h.i.L.a.b.s.               140.2.0        
  17.0  CTL    80 06 04 03  09 04 02 04                                                                                GET DESCRIPTOR                         141.1.0        
  17.0  IN     22 03 54 00  52 00 45 00  5a 00 4f 00  52 00 20 00  49 00 6e 00  74 00 65 00  72 00 66 00  61 00 63 00  ".T.R.E.Z.O.R. .I.n.t.e.r.f.a.c.       141.2.0        
               65 00                                                                                                   e.                                     141.2.32       
  18.0  CTL    80 06 03 03  09 04 02 04                                                                                GET DESCRIPTOR                         142.1.0        
  18.0  IN     32 03 32 00  34 00 45 00  32 00 32 00  46 00 41 00  46 00 35 00  35 00 45 00  36 00 30 00  37 00 45 00  2.2.4.E.2.2.F.A.F.5.5.E.6.0.7.E.       142.2.0        
               35 00 36 00  34 00 41 00  30 00 35 00  33 00 35 00  36 00                                               5.6.4.A.0.5.3.5.6.                     142.2.32       
  18.0  CTL    80 06 01 03  09 04 02 04                                                                                GET DESCRIPTOR                         143.1.0        
  18.0  IN     18 03 53 00  61 00 74 00  6f 00 73 00  68 00 69 00  4c 00 61 00  62 00 73 00                            ..S.a.t.o.s.h.i.L.a.b.s.               143.2.0        
  18.0  CTL    80 06 06 03  09 04 02 04                                                                                GET DESCRIPTOR                         144.1.0        
  18.0  IN     1c 03 55 00  32 00 46 00  20 00 49 00  6e 00 74 00  65 00 72 00  66 00 61 00  63 00 65 00               ..U.2.F. .I.n.t.e.r.f.a.c.e.           144.2.0        
  17.1  OUT    3f ff ff ff  ff ff ff ff  ff ff ff ff  ff ff ff ff  ff ff ff ff  ff ff ff ff  ff ff ff ff  ff ff ff ff  ?...............................       145.1.0        
               ff ff ff ff  ff ff ff ff  ff ff ff ff  ff ff ff ff  ff ff ff ff  ff ff ff ff  ff ff ff ff  ff ff ff ff  ................................       145.1.32       
  17.1  OUT    3f 23 23 00  00 00 00 00  00 00 00 00  00 00 00 00  00 00 00 00  00 00 00 00  00 00 00 00  00 00 00 00  ?##.............................       146.1.0        
               00 00 00 00  00 00 00 00  00 00 00 00  00 00 00 00  00 00 00 00  00 00 00 00  00 00 00 00  00 00 00 00  ................................       146.1.32       
  17.1  IN     3f 23 23 00  11 00 00 00  8b 0a 11 62  69 74 63 6f  69 6e 74 72  65 7a 6f 72  2e 63 6f 6d  10 01 18 06  ?##........bitcointrezor.com....       147.1.0        
               20 02 32 18  32 34 45 32  32 46 41 46  35 35 45 36  30 37 45 35  36 34 41 30  35 33 35 36  38 01 40 00   .2.24E22FAF55E607E564A053568.@.       147.1.32       
  17.1  IN     3f 52 06 61  6e 64 72 65  77 60 01 6a  14 c9 11 3f  d3 f5 fc d7  8e 9e 56 0d  ba c7 5e d5  aa e3 59 eb  ?R.andrew`.j...?......V...^...Y.       148.1.0        
               2d 72 20 af  b4 cf 7a 4a  57 96 10 0e  d5 41 6b 75  12 1b c7 10  08 c2 a2 fd  54 49 bd 8f  63 cc 22 a6  -r ...zJW....Aku........TI..c.".       148.1.32       
  17.1  IN     3f a7 d6 80  78 00 80 01  01 88 01 00  98 01 00 a0  01 00 aa 01  01 31 00 00  00 00 00 00  00 00 00 00  ?...x................1..........       149.1.0        
               00 00 00 00  00 00 00 00  00 00 00 00  00 00 00 00  00 00 00 00  00 00 00 00  00 00 00 00  00 00 00 00  ................................       149.1.32       
  17.1  OUT    3f 23 23 00  0b 00 00 00  1b 08 b1 80  80 80 08 08  80 80 80 80  08 08 80 80  80 80 08 22  07 42 69 74  ?##........................".Bit       150.1.0        
               63 6f 69 6e  00 00 00 00  00 00 00 00  00 00 00 00  00 00 00 00  00 00 00 00  00 00 00 00  00 00 00 00  coin............................       150.1.32       
  17.1  IN     3f 23 23 00  0c 00 00 00  c6 0a 53 08  03 10 92 b3  b9 b6 0b 18  80 80 80 80  08 22 20 cc  9f 61 a7 44  ?##.......S.............." ..a.D       151.1.0        
               9e be 32 06  ed 45 b1 1c  64 f7 6a 2a  10 63 02 b9  06 15 ef 10  38 d2 36 6e  94 33 a4 32  21 02 04 fe  ..2..E..d.j*.c......8.6n.3.2!...       151.1.32       
  17.1  IN     3f 7d e6 76  b5 b4 ff 40  27 c6 72 18  90 2c 58 ba  75 23 38 f4  c7 c0 61 2e  ed cc 08 90  64 24 2f 12  ?..v...@'.r..,X.u#8...a.....d$/.       152.1.0        
               6f 78 70 75  62 36 43 7a  68 63 53 50  73 73 64 7a  44 52 75 46  31 64 4e 45  77 33 4d 78  77 51 50 53  oxpub6CzhcSPssdzDRuF1dNEw3MxwQPS       152.1.32       
  17.1  IN     3f 65 51 65  56 4d 75 34  43 7a 43 62  56 72 6e 6e  72 61 6f 76  79 48 4b 6a  50 56 65 31  55 55 68 36  ?eQeVMu4CzCbVrnnraovyHKjPVe1UUh6       153.1.0        
               55 32 33 32  4b 63 51 4d  54 36 6b 39  50 39 46 58  42 71 75 75  61 54 50 50  47 62 4c 4c  57 66 4e 48  U232KcQMT6k9P9FXBquuaTPPGbLLWfNH       153.1.32       
  17.1  IN     3f 76 34 31  41 72 42 33  79 46 33 44  72 65 31 48  76 70 00 00  00 00 00 00  00 00 00 00  00 00 00 00  ?v41ArB3yF3Dre1Hvp..............       154.1.0        
               00 00 00 00  00 00 00 00  00 00 00 00  00 00 00 00  00 00 00 00  00 00 00 00  00 00 00 00  00 00 00 00  ................................       154.1.32       
  17.1  OUT    3f 23 23 00  0b 00 00 00  1d 08 b1 80  80 80 08 08  80 80 80 80  08 08 80 80  80 80 08 08  00 22 07 42  ?##..........................".B       155.1.0        
               69 74 63 6f  69 6e 00 00  00 00 00 00  00 00 00 00  00 00 00 00  00 00 00 00  00 00 00 00  00 00 00 00  itcoin..........................       155.1.32       
  17.1  IN     3f 23 23 00  0c 00 00 00  c2 0a 4f 08  04 10 85 f5  91 b6 04 18  00 22 20 de  a0 67 87 cd  a5 28 c4 52  ?##.......O.........." ..g...(.R       156.1.0        
               eb 6c 29 16  de 32 2a 8e  3e 9e d0 64  7d 54 37 82  1c 48 c9 08  76 7d ff 32  21 02 e6 5a  61 de 0d 8d  .l)..2*.>..d.T7..H..v..2!..Za...       156.1.32       
  17.1  IN     3f f0 25 11  e0 15 c0 42  8f f5 7e 5f  e4 15 1a 8d  1c 42 4c fe  6f 8a 66 27  65 24 3c 12  6f 78 70 75  ?.%....B..._.....BL.o.f'e$<.oxpu       157.1.0        
               62 36 45 34  35 43 6d 59  42 57 66 67  65 37 65 46  45 64 38 68  32 75 37 56  33 6a 38 35  33 71 44 70  b6E45CmYBWfge7eFEd8h2u7V3j853qDp       157.1.32       
  17.1  IN     3f 32 48 4d  7a 36 61 59  46 79 79 6f  6a 47 57 6b  52 69 4a 57  54 71 37 51  6d 62 68 73  77 73 57 79  ?2HMz6aYFyyojGWkRiJWTq7QmbhswsWy       158.1.0        
               50 33 58 47  4e 62 33 48  50 4c 45 41  61 59 41 32  64 4a 56 6b  36 52 4a 37  56 68 72 68  42 4e 6a 6f  P3XGNb3HPLEAaYA2dJVk6RJ7VhrhBNjo       158.1.32       
  17.1  IN     3f 73 74 5a  50 53 41 72  57 65 69 4a  55 55 00 00  00 00 00 00  00 00 00 00  00 00 00 00  00 00 00 00  ?stZPSArWeiJUU..................       159.1.0        
               00 00 00 00  00 00 00 00  00 00 00 00  00 00 00 00  00 00 00 00  00 00 00 00  00 00 00 00  00 00 00 00  ................................       159.1.32       
  17.1  OUT    3f 23 23 00  3a 00 00 00  45 08 ac 80  80 80 08 08  81 80 80 80  08 08 80 80  80 80 08 08  00 08 00 12  ?##.:...E.......................       160.1.0        
               01 01 1a 05  09 8b ca 5a  00 22 02 52  08 2a 14 36  cc 5c 06 d9  11 e5 f1 0e  a9 a3 9d b3  b0 b2 18 e4  .......Z.".R.*.6.\..............       160.1.32       
  17.1  OUT    3f 47 2a 76  32 07 0e 35  fa 93 1a 00  00 48 04 00  00 00 00 00  00 00 00 00  00 00 00 00  00 00 00 00  ?G*v2..5.....H..................       161.1.0        
               00 00 00 00  00 00 00 00  00 00 00 00  00 00 00 00  00 00 00 00  00 00 00 00  00 00 00 00  00 00 00 00  ................................       161.1.32       
  17.1  IN     3f 23 23 00  1a 00 00 00  02 08 08 00  00 00 00 00  00 00 00 00  00 00 00 00  00 00 00 00  00 00 00 00  ?##.............................       162.1.0(2)     
               00 00 00 00  00 00 00 00  00 00 00 00  00 00 00 00  00 00 00 00  00 00 00 00  00 00 00 00  00 00 00 00  ................................       162.1.32       
  17.1  OUT    3f 23 23 00  1b 00 00 00  00 00 00 00  00 00 00 00  00 00 00 00  00 00 00 00  00 00 00 00  00 00 00 00  ?##.............................       163.1.0(2)     
               00 00 00 00  00 00 00 00  00 00 00 00  00 00 00 00  00 00 00 00  00 00 00 00  00 00 00 00  00 00 00 00  ................................       163.1.32       
  17.1  IN     3f 23 23 00  3b 00 00 00  46 10 2b 1a  20 9b 0f c6  2f f6 95 14  bc 05 3e aa  fc 1e 3f 5c  d6 14 88 30  ?##.;...F.+. .../.....>...?\...0       166.1.0        
               64 68 45 82  63 51 79 d0  29 b1 41 18  68 22 20 5d  99 07 8a 87  3f c4 af c1  13 c4 9b 01  e7 5c f7 16  dhE.cQy.).A.h" ]....?........\..       166.1.32       
  17.1  IN     3f e7 da 93  d8 fb 35 24  8f de fb 01  5d 04 9d 1b  00 00 00 00  00 00 00 00  00 00 00 00  00 00 00 00  ?.....5$....]...................       167.1.0        
               00 00 00 00  00 00 00 00  00 00 00 00  00 00 00 00  00 00 00 00  00 00 00 00  00 00 00 00  00 00 00 00  ................................       167.1.32       
  17.0  CTL    80 06 03 03  09 04 02 04                                                                                GET DESCRIPTOR                         168.1.0        
  17.0  IN     32 03 32 00  34 00 45 00  32 00 32 00  46 00 41 00  46 00 35 00  35 00 45 00  36 00 30 00  37 00 45 00  2.2.4.E.2.2.F.A.F.5.5.E.6.0.7.E.       168.2.0        
               35 00 36 00  34 00 41 00  30 00 35 00  33 00 35 00  36 00                                               5.6.4.A.0.5.3.5.6.                     168.2.32       
  17.0  CTL    80 06 01 03  09 04 02 04                                                                                GET DESCRIPTOR                         169.1.0        
  17.0  IN     18 03 53 00  61 00 74 00  6f 00 73 00  68 00 69 00  4c 00 61 00  62 00 73 00                            ..S.a.t.o.s.h.i.L.a.b.s.               169.2.0        
  17.0  CTL    80 06 04 03  09 04 02 04                                                                                GET DESCRIPTOR                         170.1.0        
  17.0  IN     22 03 54 00  52 00 45 00  5a 00 4f 00  52 00 20 00  49 00 6e 00  74 00 65 00  72 00 66 00  61 00 63 00  ".T.R.E.Z.O.R. .I.n.t.e.r.f.a.c.       170.2.0        
               65 00                                                                                                   e.                                     170.2.32       
  18.0  CTL    80 06 03 03  09 04 02 04                                                                                GET DESCRIPTOR                         171.1.0        
  18.0  IN     32 03 32 00  34 00 45 00  32 00 32 00  46 00 41 00  46 00 35 00  35 00 45 00  36 00 30 00  37 00 45 00  2.2.4.E.2.2.F.A.F.5.5.E.6.0.7.E.       171.2.0        
               35 00 36 00  34 00 41 00  30 00 35 00  33 00 35 00  36 00                                               5.6.4.A.0.5.3.5.6.                     171.2.32       
  18.0  CTL    80 06 01 03  09 04 02 04                                                                                GET DESCRIPTOR                         172.1.0        
  18.0  IN     18 03 53 00  61 00 74 00  6f 00 73 00  68 00 69 00  4c 00 61 00  62 00 73 00                            ..S.a.t.o.s.h.i.L.a.b.s.               172.2.0        
  18.0  CTL    80 06 06 03  09 04 02 04                                                                                GET DESCRIPTOR                         173.1.0        
  18.0  IN     1c 03 55 00  32 00 46 00  20 00 49 00  6e 00 74 00  65 00 72 00  66 00 61 00  63 00 65 00               ..U.2.F. .I.n.t.e.r.f.a.c.e.           173.2.0        
